{
  "created_at": "2026-05-17T17:01:22Z",
  "expected_outputs": {
    "certificate.json": {
      "artifact_type": "ComputationWitness.v0"
    }
  },
  "from_component": "LabTrust-Gym",
  "handoff_id": "bench-computation-handoff",
  "handoff_kind": "runtime_to_certificate",
  "input_artifacts": {
    "computation_run_receipt.json": {
      "artifact_type": "ComputationRunReceipt.v0",
      "sha256": "sha256:102951c60c0258211897127db7a164ba519410aeee740a6e8405d115f17ec882"
    },
    "dataset_receipt.json": {
      "artifact_type": "DatasetReceipt.v0",
      "sha256": "sha256:2ccc0163a83dbf5a6c5b661a6b151ae7b699dc66344342d34818cf6ed2f16e5a"
    },
    "environment_receipt.json": {
      "artifact_type": "EnvironmentReceipt.v0",
      "sha256": "sha256:18cf3c35d8a7d7ad4f11e2387df537812b7a7eeaa83d0746ebfb4e2510404c51"
    },
    "result_artifact.json": {
      "artifact_type": "ResultArtifact.v0",
      "sha256": "sha256:b366603a714d12be53b422505ef05e621dab933f3a51e051c472905c2be76d7b"
    }
  },
  "invariants": {
    "property_id": "scientific_computation.reproducibility_v0",
    "run_hash": "sha256:aaaaaaaaaaaaaaaaaaaaaaaaaaaaaaaaaaaaaaaaaaaaaaaaaaaaaaaaaaaaaaaa"
  },
  "schema_version": "v0",
  "signature_or_digest": "sha256:97081102060072e4241445d8cf39cd76d2866e4f466d73dec04de7ad5d518600",
  "source_commit": "abcdef0123456789abcdef0123456789abcdef01",
  "source_repo": "https://github.com/fraware/LabTrust-Gym",
  "status": "Validated",
  "to_component": "CertifyEdge"
}
