{
  "created_at": "2026-05-17T17:01:22Z",
  "expected_outputs": {
    "certificate.json": {
      "artifact_type": "ToolUseCertificate.v0"
    }
  },
  "from_component": "LabTrust-Gym",
  "handoff_id": "bench-tool-use-handoff",
  "handoff_kind": "runtime_to_certificate",
  "input_artifacts": {
    "trace.json": {
      "artifact_type": "ToolUseTrace.v0",
      "sha256": "sha256:b9c1f67db8d9cd2ef040005413c0cee9413a26c8a9f740a5f34362b0f46940dc"
    }
  },
  "invariants": {
    "policy_hash": "sha256:bbbbbbbbbbbbbbbbbbbbbbbbbbbbbbbbbbbbbbbbbbbbbbbbbbbbbbbbbbbbbbbb",
    "property_id": "agent_tool_use.safety_v0",
    "trace_hash": "sha256:aaaaaaaaaaaaaaaaaaaaaaaaaaaaaaaaaaaaaaaaaaaaaaaaaaaaaaaaaaaaaaaa"
  },
  "schema_version": "v0",
  "signature_or_digest": "sha256:56108f9de2eaa033883f472c9e0e431541704302394b9e23631ae4a7af47b8c9",
  "source_commit": "abcdef0123456789abcdef0123456789abcdef01",
  "source_repo": "https://github.com/fraware/LabTrust-Gym",
  "status": "Validated",
  "to_component": "CertifyEdge"
}
