{
  "created_at": "2026-05-17T17:01:22Z",
  "expected_outputs": {
    "trace_certificate.json": {
      "artifact_type": "TraceCertificate.v0"
    }
  },
  "from_component": "LabTrust-Gym",
  "handoff_id": "bench-formal_facts-handoff",
  "handoff_kind": "runtime_to_certificate",
  "input_artifacts": {
    "trace.json": {
      "artifact_type": "Trace",
      "sha256": "sha256:86d76ec3d548e9c958b371f62bafc2be00e85b22c2f95e81196fb3bdb20979ae"
    }
  },
  "invariants": {
    "property_id": "hospital_lab.qc_release",
    "trace_hash": "sha256:c3e8a3dc4ad86d533de1dfa4ae7fe2a338c2cff3c945404c96a75216524d58cd"
  },
  "schema_version": "v0",
  "signature_or_digest": "sha256:f98de2fd8f1218546878f39f993685ac16ca47b18f9ad73f7f2d7e2e9f6aa31f",
  "source_commit": "4c5439ae358733f9a4c4a58e33fdaed1ab0d29de",
  "source_repo": "https://github.com/fraware/LabTrust-Gym",
  "status": "Validated",
  "to_component": "CertifyEdge"
}
